{
  "generated_at": "2026-07-21T15:33:51.241649Z",
  "records": [
    {
      "bytes": 19845,
      "final_url": "https://www.aibuilderclub.com/blog/5-levels-of-coding-agents",
      "id": "source:3e8a8bae7d4394d58f9c6735",
      "license": null,
      "path": "aibuilderclub/5-levels-of-coding-agents.md",
      "reasons": [],
      "sha256": "05a5344238ee290985bd54b613c25dedbf2ab08baba91e73150aeee3957106bb",
      "source_url": "https://www.aibuilderclub.com/blog/5-levels-of-coding-agents",
      "source_url_method": "index_link",
      "status": "accepted",
      "trust_label": "validated_untrusted"
    },
    {
      "bytes": 17776,
      "final_url": null,
      "id": "source:6b8368a195db7ae5989fb379",
      "license": null,
      "path": "aibuilderclub/_INDEX.md",
      "reasons": [],
      "sha256": "85eabda2401b5aa01478c7006182e303f548cf3231d9ec0f87b10922438302db",
      "source_url": null,
      "source_url_method": null,
      "status": "accepted",
      "trust_label": "validated_untrusted"
    },
    {
      "bytes": 36019,
      "final_url": null,
      "id": "source:48817f47d4a6b3b815ceb7e4",
      "license": null,
      "path": "aibuilderclub/_blog-index.md",
      "reasons": [
        "prompt_injection:tool_execution_request"
      ],
      "sha256": "b68716c5517c75469afedb9aedb6f55a29a7af552f2ece72dfc6fda20860c744",
      "source_url": null,
      "source_url_method": null,
      "status": "quarantined",
      "trust_label": "raw_untrusted"
    },
    {
      "bytes": 586,
      "final_url": null,
      "id": "source:01301e0f541358e8b849203a",
      "license": null,
      "path": "aibuilderclub/_failed.txt",
      "reasons": [],
      "sha256": "590f9b7119a822b2c28687cc09b3ff1d49735250031ff8e2ad84816ffc47a03c",
      "source_url": null,
      "source_url_method": null,
      "status": "accepted",
      "trust_label": "validated_untrusted"
    },
    {
      "bytes": 32403,
      "final_url": "https://www.aibuilderclub.com/blog/agent-graph-vs-loop-when-to-use",
      "id": "source:b25b3fb64613b60548b540e8",
      "license": null,
      "path": "aibuilderclub/agent-graph-vs-loop-when-to-use.md",
      "reasons": [],
      "sha256": "7fd43ff50f7afa46630543f3ce9c814773ff7c00621ecd04296e429ecb2d1a8b",
      "source_url": "https://www.aibuilderclub.com/blog/agent-graph-vs-loop-when-to-use",
      "source_url_method": "index_link",
      "status": "accepted",
      "trust_label": "validated_untrusted"
    },
    {
      "bytes": 25609,
      "final_url": "https://www.aibuilderclub.com/blog/agent-memory-systems-guide",
      "id": "source:8cac8611250e914bc4a41749",
      "license": null,
      "path": "aibuilderclub/agent-memory-systems-guide.md",
      "reasons": [
        "prompt_injection:system_prompt_request"
      ],
      "sha256": "a26b1fbd45f49b256c21dda0f97fc13abb19dab6e211f3f4896df021fc9eb504",
      "source_url": "https://www.aibuilderclub.com/blog/agent-memory-systems-guide",
      "source_url_method": "index_link",
      "status": "quarantined",
      "trust_label": "raw_untrusted"
    },
    {
      "bytes": 23958,
      "final_url": "https://www.aibuilderclub.com/blog/agent-modes-plan-default-auto",
      "id": "source:ddea9ddc7869da332ccce57e",
      "license": null,
      "path": "aibuilderclub/agent-modes-plan-default-auto.md",
      "reasons": [],
      "sha256": "03822542a6a601acfbbb493f1809fd725b53290193c054b3098004ef0e33a2a1",
      "source_url": "https://www.aibuilderclub.com/blog/agent-modes-plan-default-auto",
      "source_url_method": "index_link",
      "status": "accepted",
      "trust_label": "validated_untrusted"
    },
    {
      "bytes": 24782,
      "final_url": "https://www.aibuilderclub.com/blog/agent-sandbox-os-level-security",
      "id": "source:498498490d893029309a591d",
      "license": null,
      "path": "aibuilderclub/agent-sandbox-os-level-security.md",
      "reasons": [],
      "sha256": "ca7a9cf95c708356b3816e27e468b7ade33822dc2ab857244ec1c8cfb3f525df",
      "source_url": "https://www.aibuilderclub.com/blog/agent-sandbox-os-level-security",
      "source_url_method": "index_link",
      "status": "accepted",
      "trust_label": "validated_untrusted"
    },
    {
      "bytes": 33571,
      "final_url": "https://www.aibuilderclub.com/blog/agent-skills-best-practices-guide",
      "id": "source:71ed7d596fd6f14ee08f03f8",
      "license": null,
      "path": "aibuilderclub/agent-skills-best-practices-guide.md",
      "reasons": [],
      "sha256": "5273d8c6c4f48196460691318bd00ea7d87a92f63f7ca9f9ca67dd6235cbafbc",
      "source_url": "https://www.aibuilderclub.com/blog/agent-skills-best-practices-guide",
      "source_url_method": "index_link",
      "status": "accepted",
      "trust_label": "validated_untrusted"
    },
    {
      "bytes": 17615,
      "final_url": "https://www.aibuilderclub.com/blog/ai-agent-reliability-cost-control",
      "id": "source:7ec1816390dc899625f92199",
      "license": null,
      "path": "aibuilderclub/ai-agent-reliability-cost-control.md",
      "reasons": [],
      "sha256": "f21e0586c6c0d2ee790f193f5da4cd61e459b60f7b22de09846e7584b262104e",
      "source_url": "https://www.aibuilderclub.com/blog/ai-agent-reliability-cost-control",
      "source_url_method": "index_link",
      "status": "accepted",
      "trust_label": "validated_untrusted"
    },
    {
      "bytes": 37692,
      "final_url": "https://www.aibuilderclub.com/blog/ai-agents-101-part-1",
      "id": "source:eecb3f02a72e122e458f67d0",
      "license": null,
      "path": "aibuilderclub/ai-agents-101-part-1.md",
      "reasons": [
        "prompt_injection:system_prompt_request",
        "prompt_injection:tool_execution_request"
      ],
      "sha256": "600879870437e3696dc83c017b0c9fadd9dc3a6ada9c59ac42514b5a26ed0883",
      "source_url": "https://www.aibuilderclub.com/blog/ai-agents-101-part-1",
      "source_url_method": "index_link",
      "status": "quarantined",
      "trust_label": "raw_untrusted"
    },
    {
      "bytes": 42957,
      "final_url": "https://www.aibuilderclub.com/blog/ai-agents-101-part-2",
      "id": "source:68e2be3882802b7cbbea5c8f",
      "license": null,
      "path": "aibuilderclub/ai-agents-101-part-2.md",
      "reasons": [
        "prompt_injection:system_prompt_request",
        "prompt_injection:tool_execution_request"
      ],
      "sha256": "0d2764b24e330e3ad6d02052eb88ecb5817858620637cd3936982280e3ef1287",
      "source_url": "https://www.aibuilderclub.com/blog/ai-agents-101-part-2",
      "source_url_method": "index_link",
      "status": "quarantined",
      "trust_label": "raw_untrusted"
    },
    {
      "bytes": 35917,
      "final_url": "https://www.aibuilderclub.com/blog/ai-agents-101-part-3",
      "id": "source:66fbf14b37c1f6137baa57c7",
      "license": null,
      "path": "aibuilderclub/ai-agents-101-part-3.md",
      "reasons": [
        "prompt_injection:system_prompt_request"
      ],
      "sha256": "9832640cfa0ef45565a54259a010d8f9f47baac98ff7ffb206bc8b7dbb0fe85d",
      "source_url": "https://www.aibuilderclub.com/blog/ai-agents-101-part-3",
      "source_url_method": "index_link",
      "status": "quarantined",
      "trust_label": "raw_untrusted"
    },
    {
      "bytes": 44422,
      "final_url": "https://www.aibuilderclub.com/blog/ai-agents-101-part-4",
      "id": "source:a30ea9403fdd8aab208a8028",
      "license": null,
      "path": "aibuilderclub/ai-agents-101-part-4.md",
      "reasons": [
        "prompt_injection:system_prompt_request",
        "prompt_injection:tool_execution_request"
      ],
      "sha256": "b4d9e96358d53a9385c74167f2490f733660d38e8a1d269ea8cd7d847b66edb7",
      "source_url": "https://www.aibuilderclub.com/blog/ai-agents-101-part-4",
      "source_url_method": "index_link",
      "status": "quarantined",
      "trust_label": "raw_untrusted"
    },
    {
      "bytes": 42169,
      "final_url": "https://www.aibuilderclub.com/blog/ai-agents-101-part-5",
      "id": "source:35b09b9104e8db9472bc6206",
      "license": null,
      "path": "aibuilderclub/ai-agents-101-part-5.md",
      "reasons": [
        "prompt_injection:tool_execution_request"
      ],
      "sha256": "f41636ca6beac4be366c4741de806c14bd3b04aa0dc2e6a3208653df1ccc5f01",
      "source_url": "https://www.aibuilderclub.com/blog/ai-agents-101-part-5",
      "source_url_method": "index_link",
      "status": "quarantined",
      "trust_label": "raw_untrusted"
    },
    {
      "bytes": 36781,
      "final_url": "https://www.aibuilderclub.com/blog/ai-agents",
      "id": "source:4703357b808198e7842b8385",
      "license": null,
      "path": "aibuilderclub/ai-agents.md",
      "reasons": [
        "prompt_injection:system_prompt_request",
        "prompt_injection:tool_execution_request"
      ],
      "sha256": "ca90b8163831ed0c32927abab65d30e8365feedcce218c9084a3b07b30c95ae1",
      "source_url": "https://www.aibuilderclub.com/blog/ai-agents",
      "source_url_method": "index_link",
      "status": "quarantined",
      "trust_label": "raw_untrusted"
    },
    {
      "bytes": 37504,
      "final_url": "https://www.aibuilderclub.com/blog/ai-coding-agent-memory-agentmemory",
      "id": "source:814f71872c30e6acb9ff2458",
      "license": null,
      "path": "aibuilderclub/ai-coding-agent-memory-agentmemory.md",
      "reasons": [
        "prompt_injection:tool_execution_request"
      ],
      "sha256": "ce44be1fe5af6d415cc8b5efab3b0dcbd862f45d5493dceb9e13b6822ee1e164",
      "source_url": "https://www.aibuilderclub.com/blog/ai-coding-agent-memory-agentmemory",
      "source_url_method": "index_link",
      "status": "quarantined",
      "trust_label": "raw_untrusted"
    },
    {
      "bytes": 10331,
      "final_url": "https://www.aibuilderclub.com/blog/ai-data-analysis-no-code",
      "id": "source:878b91f47f76154c36718e2f",
      "license": null,
      "path": "aibuilderclub/ai-data-analysis-no-code.md",
      "reasons": [],